count,date,title,description,org_link,link
745,2023-06-15 23:06:00,"&quot;내 영양제&quot;…한소희, 팬이 준 선물 인증→남다른 팬 사랑 눈길","이를 본 네티즌들은 &quot;해가 뜬 줄 알았는데 당신이 뜬 거였어&quot;, &quot;나도 우리 배우님 또 만나면 영양제 한 바구니 안겨드릴 텐데&quot;, &quot;내 <b>자양강장제</b> 내 비타민 내 칼슘 내 마그네슘 내 프로바이오틱스 내 오메가3&quot; 등의 반응을... ",http://www.topstarnews.net/news/articleView.html?idxno=15352529,http://www.topstarnews.net/news/articleView.html?idxno=15352529
746,2023-06-15 14:37:00,"'모던뽀이'가 사랑한 맥주, <b>자양강장제</b> 대접받았다고? [책과 세상]","&quot;큰 병맥주 1병의 <b>자양</b> 량은 우육 반근과 같다.&quot; 1930년 맥주 광고 카피는 이랬다. 그야말로 과장 광고인 셈인데, 그 당시 술에 부여된 중요한 가치가 <b>자양</b>과 영양이었다는 사실을 알려주고 있다. 연말연시 최고의... ",https://www.hankookilbo.com/News/Read/A2023061317440002315?did=NA,https://n.news.naver.com/mnews/article/469/0000744646?sid=103
747,2023-06-14 07:32:00,[더벨][조달전략 분석]동아쏘시오 계열사 성장실탄 확충묘안 '자산효율화',"<b>자양강장제</b> '박카스'와 '감기약 '판피린' 등 동아제약 주력 제품의 유리병을 양산해 공급해왔다. 경기 안양, 충북 음성, 충남 보령 등에 생산 공장을 뒀으나 2010년대 들어 시설이 갈수록 노후되는 문제를 해결해야... ",https://www.thebell.co.kr/free/content/ArticleView.asp?key=202306070849121300104642,https://www.thebell.co.kr/free/content/ArticleView.asp?key=202306070849121300104642
748,2023-06-13 05:32:00,"처녀자리 '작정하고 일이 꼬이는 날', 천칭자리 '자신의 문제를 다른 사람에게...","<b>자양강장제</b> 전갈자리 : 허심탄회한 대화의 자리를 마련하자 견고하던 사랑탑이 흔들흔들 하진 않나 확인이 필요한 날이다 요즘 유난히 남친, 여친의 심기가 불편한 것 같단 생각이 들진 않았는지? 오늘 허심탄회한 대화의... ",https://www.econovill.com/news/articleView.html?idxno=614246,https://www.econovill.com/news/articleView.html?idxno=614246
749,2023-06-13 00:32:00,오늘의 별자리 운세(6월 13일),"<b>자양강장제</b> 전갈자리 견고하던 사랑탑이 흔들흔들 하진 않나 확인이 필요한 날이다 요즘 유난히 남친, 여친의 심기가 불편한 것 같단 생각이 들진 않았는지? 오늘 허심탄회한 대화의 자리를 마련하자. 큰맘 먹고 근사한... ",http://www.hansbiz.co.kr/news/articleView.html?idxno=653198,http://www.hansbiz.co.kr/news/articleView.html?idxno=653198
750,2023-06-13 00:06:00,[오늘의 운세] 2023년 6월 13일(화) ★별자리 운세★,"<b>자양강장제</b>▲전갈자리견고하던 사랑탑이 흔들흔들 하진 않나 확인이 필요한 날이다 요즘 유난히 남친, 여친의 심기가 불편한 것 같단 생각이 들진 않았는지? 오늘 허심탄회한 대화의 자리를 마련하자. 큰맘 먹고 근사한... ",http://www.srtimes.kr/news/articleView.html?idxno=136911,http://www.srtimes.kr/news/articleView.html?idxno=136911
751,2023-06-13 00:02:00,[오늘의운세] 6월13일(화) 띠별·별자리,"<b>자양강장제</b> 전갈자리 견고하던 사랑탑이 흔들흔들 하진 않나 확인이 필요한 날이다 요즘 유난히 남친, 여친의 심기가 불편한 것 같단 생각이 들진 않았는지? 오늘 허심탄회한 대화의 자리를 마련하자. 큰맘 먹고 근사한... ",http://www.fntimes.com/html/view.php?ud=202306122249564613c1c16452b0_18,http://www.fntimes.com/html/view.php?ud=202306122249564613c1c16452b0_18
752,2023-06-13 00:02:00,"2023년 6월13일(화) '오늘의운세' 띠별, 별자리","<b>자양강장제</b> 전갈자리 견고하던 사랑탑이 흔들흔들 하진 않나 확인이 필요한 날이다 요즘 유난히 남친, 여친의 심기가 불편한 것 같단 생각이 들진 않았는지? 오늘 허심탄회한 대화의 자리를 마련하자. 큰맘 먹고 근사한... ",https://www.mhns.co.kr/news/articleView.html?idxno=554822,https://www.mhns.co.kr/news/articleView.html?idxno=554822
753,2023-06-13 00:02:00,[오늘의 별자리 운세] 2023년 6월 13일 화요일,"<b>자양강장제</b> 전갈자리 견고하던 사랑탑이 흔들흔들 하진 않나 확인이 필요한 날이다 요즘 유난히 남친, 여친의 심기가 불편한 것 같단 생각이 들진 않았는지? 오늘 허심탄회한 대화의 자리를 마련하자. 큰맘 먹고 근사한... ",http://www.joongboo.com/news/articleView.html?idxno=363596009,http://www.joongboo.com/news/articleView.html?idxno=363596009
754,2023-06-13 00:02:00,오늘의운세-띠별(6월 13일),"<b>자양강장제</b> 전갈자리 견고하던 사랑탑이 흔들흔들 하진 않나 확인이 필요한 날이다 요즘 유난히 남친, 여친의 심기가 불편한 것 같단 생각이 들진 않았는지? 오늘 허심탄회한 대화의 자리를 마련하자. 큰맘 먹고 근사한... ",http://www.kjdaily.com/article.php?aid=1686582000604073227,http://www.kjdaily.com/article.php?aid=1686582000604073227
755,2023-06-12 19:02:00,2023년 6월 13일 별자리 운세,"<b>자양강장제</b> 전갈자리 견고하던 사랑탑이 흔들흔들 하진 않나 확인이 필요한 날이다 요즘 유난히 남친, 여친의 심기가 불편한 것 같단 생각이 들진 않았는지? 오늘 허심탄회한 대화의 자리를 마련하자. 큰맘 먹고 근사한... ",http://woman.chosun.com/news/articleView.html?idxno=109690,http://woman.chosun.com/news/articleView.html?idxno=109690
756,2023-06-12 08:32:00,"‘범도3’ 최동구, 꿈은 현실이 된다[인터뷰]","제대로 시작하자는 마음에 <b>자양강장제</b> 음료 1박스를 들고 무작정 학원으로 쳐들어갔죠. 그렇게 연기를 시작했고, 연극영화학과에 진학하면서 영화는 혼자의 작업이 아닌 모두의 작업이라는 걸 깨닫게 됐습니다.”... ",http://sports.khan.co.kr/news/sk_index.html?art_id=202306120830003&sec_id=540401&pt=nv,https://n.news.naver.com/mnews/article/144/0000892699?sid=106
757,2023-06-12 05:32:00,"게자리 '연인에게 든든한 바람막이가 되어줘라', 사자자리 '오늘만은 그 사람...","블랙진 황소자리 : 컨디션이 상승하는 날 <b>자양강장제</b> 세 병을 한꺼번에 마신 듯, 컨디션이 업업업 상승하는 날이다. 몸도 가뿐한 것이, 기분도 좋으니 뭐든 할 수있을것 같다. 다만, 들뜬 기분에 덜렁거리다 물건을 잃어버릴... ",https://www.econovill.com/news/articleView.html?idxno=614099,https://www.econovill.com/news/articleView.html?idxno=614099
758,2023-06-12 00:32:00,오늘의 별자리 운세(6월 12일),"블랙진 황소자리 <b>자양강장제</b> 세 병을 한꺼번에 마신 듯, 컨디션이 업업업 상승하는 날이다. 몸도 가뿐한 것이, 기분도 좋으니 뭐든 할 수있을것 같다. 다만, 들뜬 기분에 덜렁거리다 물건을 잃어버릴 수 있으니 오늘 소지품... ",http://www.hansbiz.co.kr/news/articleView.html?idxno=653197,http://www.hansbiz.co.kr/news/articleView.html?idxno=653197
759,2023-06-12 00:06:00,[오늘의 운세] 2023년 6월 12일(월) ★별자리 운세★,"블랙진▲황소자리<b>자양강장제</b> 세 병을 한꺼번에 마신 듯, 컨디션이 업업업 상승하는 날이다. 몸도 가뿐한 것이, 기분도 좋으니 뭐든 할 수있을것 같다. 다만, 들뜬 기분에 덜렁거리다 물건을 잃어버릴 수 있으니 오늘 소지품... ",http://www.srtimes.kr/news/articleView.html?idxno=136828,http://www.srtimes.kr/news/articleView.html?idxno=136828
760,2023-06-12 00:02:00,[오늘의 별자리 운세] 2023년 6월 12일 월요일,"블랙진 황소자리 <b>자양강장제</b> 세 병을 한꺼번에 마신 듯, 컨디션이 업업업 상승하는 날이다. 몸도 가뿐한 것이, 기분도 좋으니 뭐든 할 수있을것 같다. 다만, 들뜬 기분에 덜렁거리다 물건을 잃어버릴 수 있으니 오늘 소지품... ",http://www.joongboo.com/news/articleView.html?idxno=363596007,http://www.joongboo.com/news/articleView.html?idxno=363596007
761,2023-06-12 00:02:00,"2023년 6월12일(월) '오늘의운세' 띠별, 별자리","블랙진 황소자리 <b>자양강장제</b> 세 병을 한꺼번에 마신 듯, 컨디션이 업업업 상승하는 날이다. 몸도 가뿐한 것이, 기분도 좋으니 뭐든 할 수있을것 같다. 다만, 들뜬 기분에 덜렁거리다 물건을 잃어버릴 수 있으니 오늘... ",https://www.mhns.co.kr/news/articleView.html?idxno=554712,https://www.mhns.co.kr/news/articleView.html?idxno=554712
762,2023-06-12 00:02:00,오늘의운세-띠별(6월 12일),"블랙진 황소자리 <b>자양강장제</b> 세 병을 한꺼번에 마신 듯, 컨디션이 업업업 상승하는 날이다. 몸도 가뿐한 것이, 기분도 좋으니 뭐든 할 수있을것 같다. 다만, 들뜬 기분에 덜렁거리다 물건을 잃어버릴 수 있으니 오늘... ",http://www.kjdaily.com/article.php?aid=1686495600603964227,http://www.kjdaily.com/article.php?aid=1686495600603964227
763,2023-06-12 00:02:00,[오늘의운세] 6월12일(월) 띠별·별자리,"블랙진 황소자리 <b>자양강장제</b> 세 병을 한꺼번에 마신 듯, 컨디션이 업업업 상승하는 날이다. 몸도 가뿐한 것이, 기분도 좋으니 뭐든 할 수있을것 같다. 다만, 들뜬 기분에 덜렁거리다 물건을 잃어버릴 수 있으니 오늘... ",http://www.fntimes.com/html/view.php?ud=20230609232302822c1c16452b0_18,http://www.fntimes.com/html/view.php?ud=20230609232302822c1c16452b0_18
764,2023-06-11 19:02:00,2023년 6월 12일 별자리 운세,"블랙진 황소자리 <b>자양강장제</b> 세 병을 한꺼번에 마신 듯, 컨디션이 업업업 상승하는 날이다. 몸도 가뿐한 것이, 기분도 좋으니 뭐든 할 수있을것 같다. 다만, 들뜬 기분에 덜렁거리다 물건을 잃어버릴 수 있으니 오늘 소지품... ",http://woman.chosun.com/news/articleView.html?idxno=109689,http://woman.chosun.com/news/articleView.html?idxno=109689
765,2023-06-11 16:07:00,"피로회복 음료수, 의외의 건강 효능 밝혀졌다","타우린은 <b>자양강장제</b>, 피로회복제 등 음료수 제품의 주성분으로 잘 알려졌다. 타우린은 고농도로 많이 섭취해도 몸에 쌓이거나 독성이 생기지 않는다. 또 뇌의 혈관 장벽으로 쉽게 투과되어 흡수되기 때문에 음식으로... ",http://weekly.chosun.com/news/articleView.html?idxno=26916,https://n.news.naver.com/mnews/article/053/0000036741?sid=103
766,2023-06-10 08:58:00,[과학을읽다]쓰러진 황소 일으키는 낙지…이유 찾았다,이미 타우린은 인간에게도 그동안 피로회복·<b>자양강장제</b>의 주성분으로 많이 복용 돼 왔다. 미국 컬럼비아대 연구팀은 지난 8일 이같은 내용의 연구 논문을 국제학술지 사이언스(science)에 게재했다. 타우린은 몸속에서... ,https://view.asiae.co.kr/article/2023061008565072817,https://n.news.naver.com/mnews/article/277/0005270754?sid=105
767,2023-06-09 07:08:00,[바이오USA]'바이오의 요람' 보스턴으로 간 '박카스'…&quot;글로벌 진출을 위한 교...,"현지시간 6일 오후 3시가 넘는 시각, 미국 보스턴 소재 케임브릿지혁신센터(CIC) 11층에서 국민 <b>자양강장제</b> 박카스를 마주했다. 동아에스티는 옛 동아제약의 명성을 찾고 글로벌 신약개발 기업으로 도약하기 위해 이곳에... ",https://www.newsway.co.kr/news/view?ud=2023060900422496010,https://www.newsway.co.kr/news/view?ud=2023060900422496010
768,2023-06-07 10:20:00,[칼럼] 발기부전 막기 위해 일상생활에서 실천 가능한 예방법은?,하지만 많은 남성들이 생활습관의 개선 보다는 한 번에 효과를 볼 수 있는 발기부전 치료제나 정력에 좋은 <b>자양강장제</b> 등을 찾는 경우가 많다. 이러한 경우 발기부전이 발생하더라도 제대로 치료를 받지 않고 혼자서 해결을... ,http://www.newskr.kr/news/articleView.html?idxno=90572,http://www.newskr.kr/news/articleView.html?idxno=90572
769,2023-06-05 07:01:00,23년차 아나운서 김용필이 가수가 된 사연 &quot;방송에 대한 절실함이었다&quot; (스타...,"김용필은 팬이 선물한 <b>자양강장제</b> 음료를 보여주며 &quot;아까워서 못 먹겠더라&quot;라며 자랑했다. 이어 대세의 상징인 응원봉과 맞춤케이크, 응원 메시지 등을 자랑하며 팬들에게 고마움을 전했다. 아내에 대한 이야기도 꺼냈다.... ",https://www.tvreport.co.kr/https://tvreport.co.kr/broadcast/article/731176/,https://n.news.naver.com/mnews/article/213/0001257251?sid=106
770,2023-06-03 00:06:00,발기부전 막기 위해 일상생활에서 실천 가능한 예방법은?,하지만 많은 남성들이 생활습관의 개선 보다는 한 번에 효과를 볼 수 있는 발기부전 치료제나 정력에 좋은 <b>자양강장제</b> 등을 찾는 경우가 많다. 이러한 경우 발기부전이 발생하더라도 제대로 치료를 받지 않고 혼자서 해결을... ,http://www.edaily.co.kr/news/newspath.asp?newsid=01095526635638112,https://n.news.naver.com/mnews/article/018/0005500238?sid=102
771,2023-06-02 11:44:00,"둥지쌍화차, 2023 서울국제식품산업대전서 K-TEA 겨냥한 쌍화차 공개... &quot;정읍...",제약사에서 만들어 판매하는 것은 <b>자양강장제</b>로 분류하기도 한다. 서울푸드 2023에서 레트로 콘셉트 전북상회 공동관에 부스를 마련한 둥지쌍화차는 전라북도(도지사 김관영)와 전북바이오융합산업진흥원(원장 이은미)... ,https://kr.aving.net/news/articleView.html?idxno=1779891,https://kr.aving.net/news/articleView.html?idxno=1779891
772,2023-06-02 10:20:00,6월 2일 '디아블로 4' 얼리 액세스 시작...네티즌 &quot;한 시간 플레이 하면 5분 ...,"이 네티즌은 &quot;(게임 플레이를 오래 하기 위해) <b>자양강장제</b> 음료 등을 먹고 버티면서 게임플레이를 하는 것은 학생 때나 가능했던거지, 다 커서 그러면 진짜 위험하다. 종합비타민 챙겨먹고 게임 플레이 한 시간 할 때마다... ",https://weekly.cnbnews.com/news/article.html?no=151047,https://weekly.cnbnews.com/news/article.html?no=151047
773,2023-06-02 05:32:00,"전갈자리 '에너지가 넘치는 하루', 사수자리 '스트레스 받은 당신~'[금요일 별...",힘들 땐 비타민이나 <b>자양강장제</b>를 챙겨먹는 것도 방법이겠다. 생각지 않던 곳에서의 횡재수가 있으나 돈 나갈 일이 더 많겠다. 오늘엔 딱! 핸드폰 양자리 : 자신을 조절해야 하는 날 가능한 자신을 조절해야 하는 날이다.... ,https://www.econovill.com/news/articleView.html?idxno=613426,https://www.econovill.com/news/articleView.html?idxno=613426
774,2023-06-02 00:32:00,오늘의 별자리 운세(6월 2일),힘들 땐 비타민이나 <b>자양강장제</b>를 챙겨먹는 것도 방법이겠다. 생각지 않던 곳에서의 횡재수가 있으나 돈 나갈 일이 더 많겠다. 오늘엔 딱! 핸드폰 양자리 가능한 자신을 조절해야 하는 날이다. 사리판단이 흐려지니 앞에... ,http://www.hansbiz.co.kr/news/articleView.html?idxno=652373,http://www.hansbiz.co.kr/news/articleView.html?idxno=652373
775,2023-06-02 00:32:00,[오늘의운세] 6월2일(금) 띠별·별자리,힘들 땐 비타민이나 <b>자양강장제</b>를 챙겨먹는 것도 방법이겠다. 생각지 않던 곳에서의 횡재수가 있으나 돈 나갈 일이 더 많겠다. 오늘엔 딱! 핸드폰 양자리 가능한 자신을 조절해야 하는 날이다. 사리판단이 흐려지니 앞에... ,http://www.fntimes.com/html/view.php?ud=20230602002918730c1c16452b0_18,http://www.fntimes.com/html/view.php?ud=20230602002918730c1c16452b0_18
776,2023-06-02 00:06:00,[오늘의 운세] 2023년 6월 2일(금) ★별자리 운세★,힘들 땐 비타민이나 <b>자양강장제</b>를 챙겨먹는 것도 방법이겠다. 생각지 않던 곳에서의 횡재수가 있으나 돈 나갈 일이 더 많겠다.오늘엔 딱! 핸드폰▲양자리가능한 자신을 조절해야 하는 날이다. 사리판단이 흐려지니 앞에... ,http://www.srtimes.kr/news/articleView.html?idxno=136466,http://www.srtimes.kr/news/articleView.html?idxno=136466
777,2023-06-02 00:02:00,"2023년 6월2일(금) '오늘의운세' 띠별, 별자리",힘들 땐 비타민이나 <b>자양강장제</b>를 챙겨먹는 것도 방법이겠다. 생각지 않던 곳에서의 횡재수가 있으나 돈 나갈 일이 더 많겠다. 오늘엔 딱! 핸드폰 양자리 가능한 자신을 조절해야 하는 날이다. 사리판단이 흐려지니... ,https://www.mhns.co.kr/news/articleView.html?idxno=554264,https://www.mhns.co.kr/news/articleView.html?idxno=554264
778,2023-06-02 00:02:00,[오늘의 별자리 운세] 2023년 6월 2일 금요일,힘들 땐 비타민이나 <b>자양강장제</b>를 챙겨먹는 것도 방법이겠다. 생각지 않던 곳에서의 횡재수가 있으나 돈 나갈 일이 더 많겠다. 오늘엔 딱! 핸드폰 양자리 가능한 자신을 조절해야 하는 날이다. 사리판단이 흐려지니 앞에... ,http://www.joongboo.com/news/articleView.html?idxno=363593977,http://www.joongboo.com/news/articleView.html?idxno=363593977
779,2023-06-02 00:02:00,오늘의운세-띠별(6월 2일),힘들 땐 비타민이나 <b>자양강장제</b>를 챙겨먹는 것도 방법이겠다. 생각지 않던 곳에서의 횡재수가 있으나 돈 나갈 일이 더 많겠다. 오늘엔 딱! 핸드폰 양자리 가능한 자신을 조절해야 하는 날이다. 사리판단이 흐려지니 앞에... ,http://www.kjdaily.com/article.php?aid=1685631600603399227,http://www.kjdaily.com/article.php?aid=1685631600603399227
780,2023-06-02 00:01:00,[오늘의 운세] 2023년 6월2일 띠별‧별자리,힘들 땐 비타민이나 <b>자양강장제</b>를 챙겨먹는 것도 방법이겠다. 생각지 않던 곳에서의 횡재수가 있으나 돈 나갈 일이 더 많겠다. 오늘엔 딱! 핸드폰 [양자리] 가능한 자신을 조절해야 하는 날이다. 사리판단이 흐려지니... ,http://www.inews24.com/view/1598763,https://n.news.naver.com/mnews/article/031/0000749832?sid=103
781,2023-06-01 19:02:00,2023년 6월 2일 별자리 운세,힘들 땐 비타민이나 <b>자양강장제</b>를 챙겨먹는 것도 방법이겠다. 생각지 않던 곳에서의 횡재수가 있으나 돈 나갈 일이 더 많겠다. 오늘엔 딱! 핸드폰 양자리 가능한 자신을 조절해야 하는 날이다. 사리판단이 흐려지니 앞에... ,http://woman.chosun.com/news/articleView.html?idxno=109418,http://woman.chosun.com/news/articleView.html?idxno=109418
782,2023-06-01 00:00:00,[오늘의 운세] 2023년 06월 01일 별자리 운세,"행운의 아이템 : <b>자양강장제</b> [처녀자리 8.23 ~ 9.22] 오늘 당신은 고삐풀린 망아지, 브레이크 고장난 자동차. 스스로를 컨트롤하는데 제동장치가 말을 듣지 않으니 자칫하다간 망신살 뻗치기 딱 좋은 날이다. 순간의 감정에... ",https://www.ytn.co.kr/_ln/0121_202306010000000002,https://n.news.naver.com/mnews/article/052/0001891732?sid=004
783,2023-05-31 22:46:00,첫 산문집 펴낸 싱어송라이터 이적 “독자의 상상력 불붙일 부싯돌 같은 책 됐...,그는 “독자들이 제 책을 침대 머리맡에 두고 일상에서 뭔가 막혔다고 생각될 때 부담 없이 아무 페이지나 펼쳐볼 수 있는 그런 책이 됐으면 좋겠어요. <b>자양강장제</b>나 비타민처럼 머릿속 상상력의 시동을 걸어주는 거죠.”,https://www.khan.co.kr/people/people-general/article/202305312245045,https://n.news.naver.com/mnews/article/032/0003227190?sid=102
784,2023-05-31 17:08:00,첫 산문집 펴낸 이적 &quot;비타민·<b>자양강장제</b> 같은 책&quot;,"그는 이번 책에 관해 &quot;독자의 상상에 시동을 걸어주는 비타민, <b>자양강장제</b> 같은 책이 됐으면 좋겠다&quot;고 말했다. 다음 행보는 음악극이 될 가능성이 높다. 노래와 책으로 대중을 만나 온 그는 앞으로 음악에 관한 책을... ",https://view.asiae.co.kr/article/2023053117071470652,https://n.news.naver.com/mnews/article/277/0005266732?sid=103
785,2023-05-31 16:47:00,"산문집 &lt;이적의 단어들&gt; 펴낸 이적, “상상력에 시동 걸어주고파”",그는 “독자들이 제 책을 침대 머리맡에 두고 일상에서 뭔가 막혔다고 생각될 때 부담 없이 아무 페이지나 펼쳐볼 수 있는 그런 책이 됐으면 좋겠어요. <b>자양강장제</b>나 비타민처럼 머릿속 상상력의 시동을 걸어주는 거죠.”,https://www.khan.co.kr/people/people-general/article/202305311646011,https://n.news.naver.com/mnews/article/032/0003227085?sid=102
786,2023-05-30 19:02:00,요강 뒤집는 복분자…알고보니 노화 막는 '항산화 작물',"복분자라는 이름도 한자 엎어질 복(覆), 요강 분(盆)로 만들어진 만큼 <b>자양강장제</b> 역할을 해왔다. 최근에는 복분자의 항산화 효능이 입증되면서 제철이 여름이면 수요가 늘고 있다. 30일 식품업계는 날이 점차 더워지면서... ",http://www.newsis.com/view/?id=NISX20230530_0002321450&cID=13107&pID=13200,https://n.news.naver.com/mnews/article/003/0011887440?sid=102
787,2023-05-30 09:23:00,베트남에서 펄펄나는 조아제약의 비결③[해외서 금맥캐는 K바이오],조아제약은 디노와 잘크톤시리즈 외에 △기능성원료인 홍삼과 지구력 증진에 대한 기능성 원료인 옥사코사놀이 주성분인 기억력 증진제 ‘조아바이톤’ △홍삼에 대추액을 석어 타사와 차별화한 수출용 <b>자양강장제</b>... ,http://www.edaily.co.kr/news/newspath.asp?newsid=01082406635614168,https://n.news.naver.com/mnews/article/018/0005496491?sid=101
788,2023-05-29 14:33:00,반가운 두 밴드의 귀환…팬들은 감격의 떼창,"3집 &lt;저스트 팝&gt;(2004)은 한국대중음악상 올해의 음반상을 받았고, 수록곡 ‘골든 글러브’는 <b>자양강장제</b> 광고에도 쓰였다. 하지만 5집 &lt;서클&gt;(2008)을 마지막으로 잠정 해체를 선언했다. 정순용(기타·보컬)은 토마스 쿡이란... ",https://www.hani.co.kr/arti/culture/culture_general/1093693.html,https://n.news.naver.com/mnews/article/028/0002641711?sid=103
789,2023-05-27 05:34:00,"천칭자리 '꺼진 불도 다시보자', 전갈자리 '에너지가 넘치는 하루'[토요일 별...",힘들 땐 비타민이나 <b>자양강장제</b>를 챙겨먹는 것도 방법이겠다. 생각지 않던 곳에서의 횡재수가 있으나 돈 나갈 일이 더 많겠다. 오늘엔 딱! 핸드폰 양자리 : 자신을 조절해야 하는 날 가능한 자신을 조절해야 하는 날이다.... ,https://www.econovill.com/news/articleView.html?idxno=612693,https://www.econovill.com/news/articleView.html?idxno=612693
790,2023-05-27 00:32:00,오늘의 별자리 운세(5월 27일),힘들 땐 비타민이나 <b>자양강장제</b>를 챙겨먹는 것도 방법이겠다. 생각지 않던 곳에서의 횡재수가 있으나 돈 나갈 일이 더 많겠다. 오늘엔 딱! 핸드폰 양자리 가능한 자신을 조절해야 하는 날이다. 사리판단이 흐려지니 앞에... ,http://www.hansbiz.co.kr/news/articleView.html?idxno=651685,http://www.hansbiz.co.kr/news/articleView.html?idxno=651685
791,2023-05-27 00:06:00,[오늘의 운세] 2023년 5월 27일(토) ★별자리 운세★,힘들 땐 비타민이나 <b>자양강장제</b>를 챙겨먹는 것도 방법이겠다. 생각지 않던 곳에서의 횡재수가 있으나 돈 나갈 일이 더 많겠다.오늘엔 딱! 핸드폰▲양자리가능한 자신을 조절해야 하는 날이다. 사리판단이 흐려지니 앞에... ,http://www.srtimes.kr/news/articleView.html?idxno=136179,http://www.srtimes.kr/news/articleView.html?idxno=136179
792,2023-05-27 00:02:00,[오늘의운세] 5월27일(토) 띠별·별자리,힘들 땐 비타민이나 <b>자양강장제</b>를 챙겨먹는 것도 방법이겠다. 생각지 않던 곳에서의 횡재수가 있으나 돈 나갈 일이 더 많겠다. 오늘엔 딱! 핸드폰 양자리 가능한 자신을 조절해야 하는 날이다. 사리판단이 흐려지니 앞에... ,http://www.fntimes.com/html/view.php?ud=202305262042411661c1c16452b0_18,http://www.fntimes.com/html/view.php?ud=202305262042411661c1c16452b0_18
793,2023-05-27 00:02:00,[오늘의 별자리 운세] 2023년 5월 27일 토요일,힘들 땐 비타민이나 <b>자양강장제</b>를 챙겨먹는 것도 방법이겠다. 생각지 않던 곳에서의 횡재수가 있으나 돈 나갈 일이 더 많겠다. 오늘엔 딱! 핸드폰 양자리 가능한 자신을 조절해야 하는 날이다. 사리판단이 흐려지니 앞에... ,http://www.joongboo.com/news/articleView.html?idxno=363592763,http://www.joongboo.com/news/articleView.html?idxno=363592763
